{
  "headline": "JWST Finds Evidence of Atmosphere on Earth-Sized Exoplanet TRAPPIST-1 b",
  "plain_language_summary": "Researchers using the James Webb Space Telescope (JWST) have found evidence that TRAPPIST-1 b, an Earth-sized rocky planet orbiting a small star, might have an atmosphere. By observing the planet's heat emissions throughout its orbit, the team discovered that heat is being redistributed from the dayside to the nightside more efficiently than would be expected for a bare rock. Additionally, they detected a slight dip in light at a wavelength where carbon dioxide (CO2) absorbs energy, suggesting a CO2-rich atmosphere might be present. While these findings suggest the planet is not just a barren rock, the exact thickness and composition of the atmosphere are still being debated and require further observations to confirm.",
  "what_is_new": [
    "First phase-curve spectral evidence suggesting an atmosphere on a rocky M-dwarf planet.",
    "Measurement of non-zero heat transport on TRAPPIST-1 b, indicating it's not a pure bare rock.",
    "Detection of spectral structure consistent with a 15-micron carbon dioxide absorption band."
  ],
  "why_caution_is_needed": [
    "The evidence is based on subtle signals that could be affected by stellar activity or instrument noise.",
    "Current data cannot definitively rule out alternative atmospheric compositions, like those rich in oxygen.",
    "The thickness of the atmosphere remains uncertain, with several possible pressure scales being plausible."
  ],
  "glossary": [
    {
      "term": "Phase curve",
      "definition": "Observations of a planet's brightness and spectrum at different points in its orbit around its star."
    },
    {
      "term": "Bond albedo",
      "definition": "The fraction of total incident solar radiation reflected by a planet back into space."
    },
    {
      "term": "M dwarf",
      "definition": "A small, relatively cool star, which is the most common type of star in the Milky Way."
    },
    {
      "term": "Retrieval models",
      "definition": "Computational methods used to infer the properties of an exoplanet's atmosphere from its observed spectrum."
    }
  ],
  "open_questions": [
    "What is the precise chemical composition and surface pressure of TRAPPIST-1 b's atmosphere?",
    "Are clouds or hazes present in the atmosphere, and how do they affect the observed spectra?",
    "Do other rocky planets in the TRAPPIST-1 system also retain significant atmospheres?"
  ]
}