{
  "headline": "COVID-19 mRNA Vaccines May Make Tumors More Vulnerable to Immunotherapy",
  "plain_language_summary": "This study explores a new way to help the immune system fight cancer. Some cancers are resistant to current immunotherapies, specifically immune checkpoint inhibitors (ICIs), because the immune system cannot 'see' them well. The researchers tested if injecting an mRNA vaccine (like the ones used for COVID-19) directly into tumors could change this. They found that in mice, this vaccination triggered a strong 'alarm' signal (interferon response) inside the tumor. This signal caused the tumor cells to show more of their proteins on their surface, making them easier for immune cells to spot and attack. When combined with ICI therapy, the treatment worked much better than ICI alone. The researchers also looked at past data from human cancer patients and found that those who had received a COVID-19 mRNA vaccine seemed to respond better to ICI treatment. While promising, this human data is retrospective and needs to be confirmed in controlled clinical trials.",
  "what_is_new": [
    "Intratumoral mRNA vaccination expands the range of tumor proteins presented to the immune system.",
    "Local mRNA delivery sensitizes previously resistant tumors to anti-PD-L1 checkpoint blockade.",
    "Retrospective human data suggests a link between recent mRNA vaccination and improved immunotherapy outcomes."
  ],
  "why_caution_is_needed": [
    "The human study part was retrospective, meaning it looked back at old data, which can have hidden biases.",
    "Patients received vaccines at different times, and their cancer types and histories varied greatly.",
    "Results in mice don't always predict exactly how a treatment will work in humans."
  ],
  "glossary": [
    {
      "term": "Immune Checkpoint Inhibitors (ICIs)",
      "definition": "Drugs that block proteins which stop the immune system from attacking cancer cells, effectively releasing the 'brakes' on the immune response."
    },
    {
      "term": "Intratumoral",
      "definition": "Administration of a substance directly into a tumor."
    },
    {
      "term": "Interferon",
      "definition": "A protein released by cells in response to the entry of a virus, which inhibits virus replication and signals the immune system."
    },
    {
      "term": "Immunopeptidome",
      "definition": "The set of protein fragments (peptides) presented on the surface of cells by MHC molecules for recognition by the immune system."
    },
    {
      "term": "Retrospective Cohort",
      "definition": "A type of study that looks back at events that have already taken place, using existing records."
    }
  ],
  "open_questions": [
    "Will the sensitization effect be seen in prospective, randomized human clinical trials?",
    "Does the timing of vaccination relative to immunotherapy treatment matter significantly?",
    "Can this approach work for all tumor types, or only specific ones?"
  ]
}