{
    "headline": "mRNA vaccines may sensitize tumors to cancer immunotherapy, a study in mice and a retrospective patient data analysis suggests.",
    "plain_language_summary": "Immune checkpoint inhibitors (ICIs) are a powerful cancer treatment, but they don't work for everyone. This study explored whether mRNA vaccines, like those used for COVID-19, could make tumors more responsive to ICIs. In experiments with mice, injecting mRNA vaccines directly into tumors triggered an immune response that made the cancer cells more visible to the immune system. When combined with ICI therapy, this led to better tumor control. The researchers also looked at data from human cancer patients and found that those who had received a SARS-CoV-2 mRNA vaccine appeared to have better survival rates when treated with ICIs. However, this human data is from a look-back (retrospective) study, which can't prove cause and effect. While the findings are promising, more research, especially in the form of prospective clinical trials, is needed to confirm if this could be a new strategy to improve cancer treatment.",
    "what_is_new": [
        "Intratumoral mRNA vaccination can trigger a potent type-I interferon response, making tumors more susceptible to immune checkpoint blockade in preclinical models.",
        "The study provides a mechanistic rationale for combining mRNA vaccines with ICI therapy by demonstrating increased antigen presentation and PD-L1 expression in tumors.",
        "A retrospective analysis of human patients provides the first clinical data suggesting a potential association between SARS-CoV-2 mRNA vaccination and improved outcomes for patients receiving ICI therapy."
    ],
    "why_caution_is_needed": [
        "The human study is retrospective and non-randomized, meaning that factors other than vaccination could be responsible for the observed survival differences.",
        "The findings from mouse models may not fully translate to human cancers, which are more diverse and complex.",
        "The timing of vaccination relative to the start of ICI treatment was not controlled in the human study, and this could be a critical factor.",
        "The study does not establish the optimal dose, type of mRNA vaccine, or which cancer types would be most likely to benefit from this approach."
    ],
    "glossary": [
        {
            "term": "Immune Checkpoint Inhibitor (ICI)",
            "definition": "A type of cancer immunotherapy that works by blocking \"checkpoint\" proteins on immune cells, allowing them to attack and kill cancer cells more effectively."
        },
        {
            "term": "mRNA Vaccine",
            "definition": "A vaccine that uses a piece of genetic material called messenger RNA (mRNA) to instruct cells in the body to make a specific protein, which in turn triggers an immune response."
        },
        {
            "term": "Intratumoral",
            "definition": "Situated or occurring within a tumor."
        },
        {
            "term": "Retrospective Study",
            "definition": "A research study that looks at data that has already been collected to look for correlations between different variables. It cannot prove causation."
        },
        {
            "term": "Type I Interferon Response",
            "definition": "A critical part of the innate immune system's response to viral infections and other threats. It plays a key role in activating other immune cells."
        }
    ],
    "open_questions": [
        "Can the findings of this study be replicated in a prospective, randomized clinical trial in humans?",
        "What is the optimal timing, dose, and type of mRNA vaccine to use for tumor sensitization?",
        "Which specific cancer types are most likely to respond to this combination therapy?",
        "Are there any long-term safety concerns associated with intratumoral mRNA vaccination?",
        "Could this approach be personalized based on the specific characteristics of a patient's tumor?"
    ]
}