{
  "headline": "New JWST Data Suggests TRAPPIST-1 b May Retain a Thin Atmosphere",
  "plain_language_summary": "Astronomers have long wondered if the Earth-sized planet TRAPPIST-1 b, which orbits very close to its star, could hold onto an atmosphere. A new study using the James Webb Space Telescope (JWST) provides evidence that it might. By observing the planet's heat and light over its entire orbit, researchers found that the planet's day side is not quite hot enough to be a bare rock, suggesting some heat is being moved to the night side by an atmosphere. Additionally, the light spectrum shows hints of carbon dioxide. While this isn't definitive proof—other models like an oxygen-rich atmosphere or certain cloud conditions could also fit the data—it strongly challenges the idea that TRAPPIST-1 b is just a barren rock. Future observations will be needed to confirm the atmosphere's composition and density.",
  "what_is_new": [
    "First joint analysis of thermal phase variation and spectral structure for TRAPPIST-1 b.",
    "Evidence of non-zero heat redistribution suggesting atmospheric transport.",
    "Detection of a spectral feature near 15 microns consistent with CO2 absorption."
  ],
  "why_caution_is_needed": [
    "The study is based on a single planet observation and may not apply to other similar planets.",
    "Instrument noise and stellar activity could mimic or hide weak atmospheric signals.",
    "Alternative explanations like oxygen-rich atmospheres or clouds haven't been ruled out."
  ],
  "glossary": [
    {
      "term": "Phase curve",
      "definition": "A graph showing how the brightness of a planet changes as it orbits its star, revealing information about its day and night sides."
    },
    {
      "term": "M dwarf",
      "definition": "A small, cool, red star that is the most common type of star in our galaxy and often hosts rocky planets like TRAPPIST-1 b."
    },
    {
      "term": "Spectroscopy",
      "definition": "The study of the interaction between matter and electromagnetic radiation, used here to identify chemical components in an atmosphere."
    },
    {
      "term": "Tidally locked",
      "definition": "A condition where a planet always shows the same face to its star, similar to how the Moon always shows the same face to Earth."
    }
  ],
  "open_questions": [
    "What is the precise chemical composition and pressure of TRAPPIST-1 b's atmosphere?",
    "Does the atmosphere contain significant amounts of oxygen or other gases besides CO2?",
    "How do clouds or hazes affect the interpretation of the planet's spectrum?",
    "Are other planets in the TRAPPIST-1 system also capable of retaining atmospheres?"
  ]
}