{
  "headline": "mRNA vaccination inside tumors may make checkpoint therapy work better",
  "plain_language_summary": "Immune checkpoint inhibitors (a kind of cancer immunotherapy) can lead to long-lasting responses for some people, but many tumors do not respond because they are not well “seen” by the immune system. This study explored whether injecting an mRNA vaccine directly into a tumor could create a local inflammatory signal dominated by type I interferons, which can boost antigen processing and presentation. In mouse tumor models, the authors report changes consistent with stronger immune priming, including broader peptide display on MHC-I and increased markers linked to responsiveness to anti-PD-L1 therapy. The paper also includes a retrospective (non-randomized) analysis of metastatic patients treated with checkpoint inhibitors, comparing outcomes by prior SARS-CoV-2 mRNA vaccination status, where a survival difference is reported. Overall, the work supports a biologically plausible strategy—using an mRNA-triggered inflammatory state to “sensitize” tumors—while emphasizing that prospective randomized trials are needed before changing clinical practice.",
  "what_is_new": [
    "Tests intratumoral delivery of an mRNA vaccine as a way to prime tumors for anti-PD-L1 therapy.",
    "Links sensitization to a type I interferon-rich state and broader MHC-I peptide presentation.",
    "Adds a retrospective human cohort comparison by SARS-CoV-2 mRNA vaccination status under ICI treatment."
  ],
  "why_caution_is_needed": [
    "The human patient analysis is retrospective and non-randomized, so confounding can explain part of the association.",
    "Vaccination timing relative to starting checkpoint inhibitors varied, complicating interpretation.",
    "Mouse tumor model findings may not translate directly to every human cancer type or clinical setting.",
    "Some mechanistic signals were strongest in specific model systems rather than uniformly across all settings."
  ],
  "glossary": [
    {
      "term": "Immune checkpoint inhibitor (ICI)",
      "definition": "A drug that releases brakes on immune cells (such as anti-PD-1/PD-L1 therapies) to help them attack cancer."
    },
    {
      "term": "Intratumoral",
      "definition": "Delivered directly into a tumor, aiming to create a strong local immune effect where cancer cells are located."
    },
    {
      "term": "Type I interferon",
      "definition": "A family of immune signaling molecules often triggered by viral sensing that can promote inflammatory and antigen-presentation programs."
    },
    {
      "term": "Antigen presentation (MHC-I)",
      "definition": "A process where cells display peptide fragments on MHC-I molecules so CD8+ T cells can recognize abnormal or tumor-derived targets."
    },
    {
      "term": "Immunopeptidome",
      "definition": "The set of peptides presented on MHC molecules that can be detected experimentally, reflecting what the immune system can potentially “see.”"
    }
  ],
  "open_questions": [
    "Would the same sensitization effect be observed in prospective randomized clinical trials in humans?",
    "Which tumor types and baseline immune states are most likely to benefit from intratumoral mRNA vaccination?",
    "What dosing, timing, and sequencing relative to checkpoint blockade best balance efficacy and safety?",
    "How durable are the immune changes (interferon signaling and antigen presentation) after intratumoral mRNA delivery?"
  ]
}
