{
  "headline": "mRNA Vaccines Prime Tumors for Immune Checkpoint Blockade: Preclinical and Retrospective Human Study Suggest Synergy",
  "plain_language_summary": "Current immunotherapies often fail because the tumor is \"invisible\" to the immune system, lacking proper antigen presentation. This study tested a new strategy: using an mRNA vaccine, similar to those for COVID-19, delivered directly into a tumor to make it more vulnerable. In mouse models, injecting the mRNA vaccine into the tumor triggered a strong local immune response, specifically a marked induction of a type I interferon signal (normalized score of 3.1 vs 1.0). This signal acts like a flare, causing the tumor to display a significantly wider array of its internal proteins on its surface, increasing the fraction of tumor proteins represented in the immunopeptidome from 37.3% to 62.3%. This expansion of the antigen presentation landscape makes the tumor much more \"visible\" to the body's T cells. This treatment also increased the checkpoint molecule PD-L1 by 2.4-fold, which rationalizes the use of checkpoint inhibitor drugs (anti-PD-L1). The combination therapy resulted in increased CD8+ T-cell density and improved tumor control in mice. Furthermore, a retrospective analysis of 130 human metastatic cancer patients treated with checkpoint inhibitors suggested that those who had previously received a standard SARS-CoV-2 mRNA vaccine had improved survival (p=0.01), cautiously suggesting the mechanism might be clinically relevant. The authors conclude that while the hypothesis is biologically sound, large prospective studies are required before clinical protocol changes are justified.",
  "what_is_new": [
    "Intratumoral mRNA vaccination strongly induces a local type I interferon response within the tumor microenvironment.",
    "This interferon signaling significantly expands the repertoire of tumor antigens presented on MHC-I, making the tumor more visible to the immune system.",
    "The combination of intratumoral mRNA delivery and immune checkpoint blockade shows synergistic efficacy in preclinical models, validating a new combination strategy."
  ],
  "why_caution_is_needed": [
    "The promising human survival data is derived from a retrospective and non-randomized cohort, meaning residual confounding cannot be ruled out.",
    "The study utilized murine models for mechanistic proof, and the effects observed may not be directly translatable to the full spectrum of human tumors.",
    "Human patient data suffered from high heterogeneity, including variations in vaccination timing, tumor type mix, and prior treatment history.",
    "Specific mechanistic readouts were strongest in particular model systems and not uniformly observed across all tested experimental settings."
  ],
  "glossary": [
    {
      "term": "Immune Checkpoint Blockade (ICI)",
      "definition": "A type of immunotherapy that works by disabling the 'brakes' on T-cells, allowing them to attack cancer."
    },
    {
      "term": "mRNA Vaccine",
      "definition": "A vaccine that instructs cells to produce a specific protein (antigen), which the immune system then learns to recognize."
    },
    {
      "term": "Anti-PD-L1 Therapy",
      "definition": "A specific class of immune checkpoint inhibitor drug that blocks the interaction between PD-1 and PD-L1 molecules."
    },
    {
      "term": "Immunopeptidome",
      "definition": "The collection of small protein fragments (peptides) displayed on the surface of a cell by MHC molecules for T-cell recognition."
    },
    {
      "term": "Type I Interferon",
      "definition": "A group of signaling proteins that play a crucial role in antiviral and antitumor immunity, inducing an inflammatory state."
    },
    {
      "term": "Retrospective Cohort",
      "definition": "A study group where data is collected on past events, making it susceptible to confounding factors compared to a randomized trial."
    }
  ],
  "open_questions": [
    "Can these findings be confirmed in a large, prospective, and randomized clinical trial setting?",
    "Which specific tumor types are most likely to respond to intratumoral mRNA sensitization?",
    "What is the optimal timing and dosing schedule for combining intratumoral mRNA delivery with standard ICI regimens?",
    "Can a non-SARS-CoV-2 mRNA (e.g., personalized cancer neoantigen mRNA) achieve similar or superior sensitization effects?",
    "Are there biomarkers to predict which patients will benefit most from this combination strategy?"
  ]
}