{
  "headline": "JWST observations suggest TRAPPIST-1 b may have an atmosphere, defying expectations for a bare rock.",
  "plain_language_summary": "TRAPPIST-1 b is an Earth-sized rocky planet orbiting very close to its star, likely with one side always facing the star (tidally locked). Scientists expected such a planet to be a bare rock with no atmosphere because of intense stellar irradiation. Using JWST's MIRI instrument, astronomers observed the planet's thermal glow as it orbited its star, measuring how heat is distributed between the day and night sides. They found evidence that heat is being redistributed between the hemispheres, and detected a spectral feature consistent with CO2 absorption. Both findings suggest the presence of an atmosphere rather than a bare surface. However, the composition and pressure of any atmosphere remain highly uncertain, and alternative interpretations cannot yet be ruled out. Follow-up observations with broader wavelength coverage are essential to confirm and characterize any atmosphere.",
  "what_is_new": [
    "First JWST phase-curve spectroscopy of TRAPPIST-1 b combining thermal and spectral constraints to probe for an atmosphere.",
    "Evidence of non-zero heat redistribution between day and night sides, inconsistent with a pure bare-rock scenario.",
    "Detection of spectral structure near 15 microns consistent with CO2 atmospheric absorption at approximately 96 ppm depth."
  ],
  "why_caution_is_needed": [
    "This is a single-planet study; results may not generalize to all M-dwarf rocky planets.",
    "Retrieval assumptions about circulation, clouds, and opacity affect the quantitative results.",
    "Stellar variability and instrument systematics could bias weak spectral features.",
    "Night-side constraints are weaker than day-side constraints, limiting interpretation.",
    "Degeneracies between composition, clouds/hazes, and circulation remain significant."
  ],
  "glossary": [
    {
      "term": "Phase curve",
      "definition": "A measurement of how a planet's brightness changes as it orbits its star, revealing heat distribution and atmospheric properties."
    },
    {
      "term": "Tidal locking",
      "definition": "When a planet always shows the same face to its star, creating permanent day and night sides like the Moon does to Earth."
    },
    {
      "term": "Heat redistribution",
      "definition": "The transport of heat from a planet's day side to its night side, typically by atmospheric winds that circulate thermal energy."
    },
    {
      "term": "CO2 band",
      "definition": "A specific wavelength range around 15 microns where carbon dioxide absorbs infrared light, serving as a spectral fingerprint."
    },
    {
      "term": "Retrieval model",
      "definition": "A computational method that works backward from observations to infer atmospheric properties like temperature and composition."
    },
    {
      "term": "Likelihood ratio",
      "definition": "A statistical measure comparing how well two different models explain the same data; higher values favor one model over another."
    },
    {
      "term": "Bond albedo",
      "definition": "The fraction of total incoming starlight that a planet reflects back to space; low values indicate a dark, light-absorbing surface."
    }
  ],
  "open_questions": [
    "What is the actual composition of TRAPPIST-1 b's atmosphere, if it existsâ€”is it CO2-rich, O2-rich, or something else?",
    "What atmospheric pressure does TRAPPIST-1 b have, and can it be constrained to the suggested 0.3-1.0 bar range?",
    "How do clouds, hazes, and atmospheric circulation affect the thermal and spectral signatures?",
    "Do other TRAPPIST-1 planets show similar atmospheric evidence, or is TRAPPIST-1 b unique?",
    "Can broader wavelength coverage definitively confirm the atmospheric detection and composition?"
  ]
}