{
  "headline": "COVID-19 mRNA Vaccines May Help Cancer Immunotherapy Work Better, Early Research Suggests",
  "plain_language_summary": "This study explored whether mRNA vaccines—similar to those used for COVID-19—could help make tumors more responsive to a type of cancer treatment called immune checkpoint inhibitors. These cancer drugs work by helping the immune system recognize and attack tumors, but they don't work well for all patients. In laboratory experiments with mice, researchers found that injecting mRNA directly into tumors created an inflammatory environment that boosted the immune response. The tumor cells displayed more proteins on their surface that immune cells could recognize as foreign, and more immune cells infiltrated the tumor. The researchers also looked at medical records of 130 cancer patients who received immunotherapy and found that those who had previously received COVID-19 mRNA vaccines tended to have better survival outcomes. While these findings are promising, the human data comes from a retrospective analysis, meaning it cannot prove cause-and-effect. Randomized clinical trials would be needed to confirm whether mRNA vaccines could become a routine part of cancer immunotherapy.",
  "what_is_new": [
    "The study reveals that intratumoral mRNA vaccination can create an interferon-rich inflammatory state that primes tumors for better responses to checkpoint blockade therapy.",
    "Researchers demonstrated that mRNA vaccination substantially expands the diversity of tumor proteins displayed on MHC-I molecules, potentially making tumors more visible to the immune system.",
    "A retrospective analysis of 130 metastatic cancer patients suggests prior SARS-CoV-2 mRNA vaccination may be associated with improved survival outcomes under ICI treatment."
  ],
  "why_caution_is_needed": [
    "The human analysis is retrospective and non-randomized, which means there may be confounding factors that explain the difference in outcomes rather than the vaccination itself.",
    "The timing of COVID-19 vaccination relative to cancer treatment initiation varied across patients, making it difficult to draw firm conclusions.",
    "The study included patients with different types of cancer and treatment histories, so the results may not apply uniformly to all cancer types.",
    "Results from mouse experiments do not always translate directly to humans, as human tumors are more complex and diverse.",
    "Prospective randomized controlled trials are still required before any clinical protocol changes can be justified."
  ],
  "glossary": [
    {
      "term": "mRNA vaccine",
      "definition": "A vaccine that uses messenger RNA to instruct cells to produce a protein that triggers an immune response. The COVID-19 vaccines from Pfizer and Moderna are examples."
    },
    {
      "term": "Immune checkpoint inhibitors (ICIs)",
      "definition": "Cancer drugs that block proteins called checkpoints, which tumors use to hide from the immune system. This allows immune cells to attack the cancer more effectively."
    },
    {
      "term": "Type I interferon",
      "definition": "Proteins produced by cells in response to viral infections or other stimuli that help regulate the immune system and can enhance the body's ability to fight tumors."
    },
    {
      "term": "MHC-I",
      "definition": "Major Histocompatibility Complex class I, a protein on cell surfaces that displays pieces of proteins from inside the cell to the immune system, allowing immune cells to detect abnormalities like cancer."
    },
    {
      "term": "Anti-PD-L1",
      "definition": "A type of checkpoint inhibitor drug that blocks the PD-L1 protein, which some tumors use to suppress immune cell activity and avoid destruction."
    },
    {
      "term": "Retrospective study",
      "definition": "A research study that looks backward at data that was already collected, rather than following patients forward in time from a defined starting point."
    }
  ],
  "open_questions": [
    "Would prospective randomized trials confirm that mRNA vaccination improves outcomes for patients receiving checkpoint inhibitor therapy?",
    "What is the optimal timing and dosage of mRNA vaccination relative to the start of cancer immunotherapy?",
    "Does the tumor sensitization effect apply equally across all cancer types, or are certain malignancies more responsive?",
    "Can the findings from mouse models be replicated consistently in human clinical settings?",
    "Would intratumoral mRNA delivery be feasible and safe as a routine clinical procedure across diverse healthcare settings?"
  ]
}
