{
  "headline": "SARS-CoV-2 mRNA vaccines can reprogram tumors to enhance the effectiveness of cancer immunotherapy in preclinical models and a human retrospective study.",
  "plain_language_summary": "The study investigates a novel strategy to make cancer immunotherapies, specifically immune checkpoint inhibitors (ICIs), more effective against tumors that are typically resistant. The core idea is to deliver an mRNA vaccine directly into the tumor. This vaccine, similar to the COVID-19 vaccines, doesn't target tumor antigens but instead acts as an innate immune trigger. The research shows that this delivery creates a high-alert, interferon-rich environment within the tumor. This change causes the cancer cells to display a wider variety of their internal proteins on their surface (antigen presentation), essentially making the tumor 'more visible' to the immune system. Furthermore, this process upregulates key signaling molecules like PD-L1 and increases the infiltration of immune cells. Preclinical mouse models demonstrated that combining the mRNA injection with anti-PD-L1 therapy improved tumor control. This finding was supported by a retrospective analysis of 130 metastatic cancer patients, where those who had received a SARS-CoV-2 mRNA vaccine prior to ICI treatment showed a better survival outcome (p=0.01). While the data is highly encouraging and provides a clear mechanism, the human data is observational, non-randomized, and requires validation in prospective clinical trials before changing standard medical practice.",
  "what_is_new": [
    "Intratumoral mRNA delivery, acting as an immune trigger, is a viable strategy to reverse immune-cold tumors into hot, ICI-responsive ones.",
    "The sensitization mechanism is mediated by Type I interferon signaling, which substantially broadens the MHC-I-presented immunopeptidome of the tumor.",
    "The study found an alignment between the preclinical mechanism and a statistically significant survival benefit in a retrospective human cohort of metastatic ICI-treated patients."
  ],
  "why_caution_is_needed": [
    "The human data is purely retrospective and observational, meaning the improved survival could be due to unmeasured confounding variables and not the vaccine itself.",
    "Preclinical results in mouse models may not fully translate to the complex heterogeneity of human tumors and their treatment histories.",
    "The optimal timing of mRNA vaccination relative to ICI initiation is unknown, as this variable was heterogeneous in the retrospective human cohort."
  ],
  "glossary": [
    {
      "term": "Immune Checkpoint Inhibitors (ICIs)",
      "definition": "A class of drugs that block proteins (like PD-1 or PD-L1) that cancer cells use to \"switch off\" the immune system, thereby releasing the immune cells to attack the tumor."
    },
    {
      "term": "Interferon (Type I)",
      "definition": "A family of signaling proteins, critical to the innate immune system, that trigger an anti-viral and inflammatory state, often leading to enhanced antigen presentation in cells."
    },
    {
      "term": "MHC-I (Major Histocompatibility Complex I)",
      "definition": "A protein complex found on the surface of nearly all cells that displays small fragments (peptides) of internal proteins, allowing T-cells to check if the cell is healthy, infected, or cancerous."
    },
    {
      "term": "Immunopeptidome",
      "definition": "The complete set of peptides displayed on the surface of a cell by MHC molecules; a key factor in determining how visible a tumor is to the immune system."
    },
    {
      "term": "Retrospective Cohort",
      "definition": "A study design where researchers look back in time at records (like medical charts) to identify risk factors or outcomes, which is prone to confounding and selection bias."
    }
  ],
  "open_questions": [
    "Can the intratumoral mRNA approach be safely and effectively administered to human patients across multiple tumor types in a prospective clinical trial?",
    "What is the optimal dose and schedule for the intratumoral mRNA vaccine to achieve maximum sensitization with minimal systemic side effects?",
    "Is the observed survival benefit in the retrospective cohort truly causal, or is it merely an association driven by an unmeasured variable?",
    "Will the sensitization effect be transient or durable, and how does the approach compare to other methods of converting \"cold\" tumors to \"hot\" ones?"
  ]
}