{
  "headline": "mRNA Vaccines May Prime Tumors for Better Response to Immune Therapy",
  "plain_language_summary": "This study investigates a novel strategy to enhance the effectiveness of cancer immunotherapy. Some tumors are resistant to immune checkpoint inhibitors (ICIs) because they do not adequately present antigens to the immune system. The researchers demonstrated that delivering an mRNA vaccine directly into the tumor induces a state rich in type I interferons. This inflammatory environment promotes broader antigen presentation on MHC-I molecules, making the tumor more visible to the immune system's T cells. In animal models, combining the mRNA vaccine with anti-PD-L1 therapy significantly improved tumor control compared to single-agent treatments. Additionally, a retrospective analysis of 130 human patients with metastatic cancer suggests that those who had previously received a SARS-CoV-2 mRNA vaccine experienced better survival outcomes when treated with ICIs. These findings provide a biological rationale for using mRNA vaccines to sensitize tumors to checkpoint blockade, though prospective clinical trials are necessary to confirm these effects.",
  "what_is_new": [
    "Intratumoral mRNA vaccination can broaden the range of tumor antigens presented to the immune system.",
    "Type I interferon signaling triggered by the vaccine increases PD-L1 expression, making tumors more targetable.",
    "Retrospective data suggests a link between prior mRNA vaccination and improved survival in patients receiving immune therapy."
  ],
  "why_caution_is_needed": [
    "The human data is retrospective, meaning it looks back at past patients and can't prove a direct cause-and-effect relationship.",
    "Patients in the study had different types of tumors and treatment histories, which could affect the results.",
    "The timing of vaccination varied, and results from mouse models do not always translate perfectly to humans."
  ],
  "glossary": [
    {
      "term": "mRNA Vaccine",
      "definition": "A type of vaccine that uses messenger RNA to trigger an immune response without using the virus itself."
    },
    {
      "term": "Immune Checkpoint Inhibitors (ICIs)",
      "definition": "Drugs that help the immune system recognize and attack cancer cells by 'releasing the brakes' on immune cells."
    },
    {
      "term": "Type I Interferon",
      "definition": "Proteins released by cells in response to pathogens that help regulate the immune system's activity."
    },
    {
      "term": "MHC-I Peptidome",
      "definition": "The collection of small protein fragments (peptides) displayed on the surface of cells for recognition by T cells."
    },
    {
      "term": "Intratumoral",
      "definition": "Delivered or occurring directly inside a tumor."
    }
  ],
  "open_questions": [
    "How long does the sensitization effect from mRNA vaccination last in humans?",
    "Are certain tumor types more responsive to this combination therapy than others?",
    "What is the optimal timing for mRNA vaccination relative to starting immune checkpoint inhibitor therapy?"
  ]
}
