{
  "headline": "JWST finds evidence that rocky exoplanet TRAPPIST-1 b likely has an atmosphere",
  "plain_language_summary": "Astronomers using the James Webb Space Telescope have gathered evidence suggesting that TRAPPIST-1 b, an Earth-sized rocky planet orbiting a small cool star, is not a bare airless world but instead appears to have an atmosphere. The study analyzed how the planet's infrared brightness changes as it orbits its star, measuring temperatures and heat movement between its day and night sides. The team found that heat spreads from the hot day side to the cooler night side more than expected for a bare rock, pointing to atmospheric heat transport. Additionally, they detected subtle spectral features consistent with carbon dioxide absorption. While this provides meaningful evidence against a strictly airless planet, important questions about the atmosphere's exact composition, pressure, and structure remain unanswered and will require further observations.",
  "what_is_new": [
    "First phase-curve spectroscopy study of TRAPPIST-1 b using JWST MIRI showing combined thermal and spectral evidence for an atmosphere.",
    "Measured heat transport efficiency of 0.19 indicating non-zero day-to-night energy redistribution beyond bare-rock expectations.",
    "Detected spectral structure around 15 microns consistent with CO2 absorption, providing composition-sensitive atmospheric evidence."
  ],
  "why_caution_is_needed": [
    "This study examines only one planet and results may not apply to all rocky planets orbiting M dwarf stars.",
    "The analysis relies on modeling assumptions about atmospheric circulation, cloud properties, and opacity that affect the quantitative results.",
    "Weak spectral signals could be affected by stellar variability or instrument systematics, and night-side measurements are less certain than day-side data.",
    "The atmosphere's exact composition, pressure, and structure remain uncertain with significant degeneracies between different atmospheric scenarios."
  ],
  "glossary": [
    {
      "term": "Phase curve",
      "definition": "A measurement of how a planet's brightness varies over its complete orbit, revealing temperature differences between its day and night sides."
    },
    {
      "term": "Heat redistribution",
      "definition": "The transport of thermal energy from a planet's hot day side to its cooler night side, typically mediated by an atmosphere or ocean."
    },
    {
      "term": "M dwarf",
      "definition": "A small, cool, long-lived type of star that is the most common star type in our galaxy and frequently hosts small rocky planets."
    },
    {
      "term": "Retrieval",
      "definition": "A computational method that uses observed spectra to infer atmospheric properties such as temperature, composition, and pressure."
    },
    {
      "term": "Tidal locking",
      "definition": "A state where a planet's rotation period matches its orbital period, causing one side to always face the star while the other remains in permanent darkness."
    }
  ],
  "open_questions": [
    "What is the precise atmospheric composition of TRAPPIST-1 b, and how much CO2 versus other gases are present?",
    "What is the atmospheric pressure and vertical structure of the planet's atmosphere?",
    "Do clouds or hazes exist in the atmosphere, and how do they affect the observed thermal emission and spectra?",
    "How common are atmospheres on rocky planets orbiting M dwarf stars, and can these findings be generalized?"
  ]
}
