{
  "headline": "JWST observations of TRAPPIST-1 b reveal signs of an atmosphere on this Earth-sized exoplanet orbiting an M dwarf star",
  "plain_language_summary": "Scientists have used NASA's James Webb Space Telescope to study TRAPPIST-1 b, a rocky planet slightly larger than Earth located about 40 light-years away. By measuring how the planet's thermal emission changes as it orbits its host star (a phase curve), researchers found evidence suggesting the planet has an atmosphere rather than being a bare rock like Mercury or the Moon. The observations show that heat is being redistributed from the planet's hot day side to its cooler night side—a process that would be difficult to achieve without an atmosphere. Additionally, subtle variations in the planet's infrared spectrum around 15 micrometers wavelength show hints of carbon dioxide absorption, which would require a substantial atmosphere. While the evidence is not definitive, it is an important step toward understanding whether potentially habitable planets around small, cool stars can retain protective atmospheres despite strong stellar radiation.",
  "what_is_new": [
    "First phase-curve observation of an Earth-sized exoplanet around an M dwarf using JWST MIRI spectroscopy, providing simultaneous constraints on thermal redistribution and atmospheric composition",
    "Detection of non-zero heat transport efficiency (epsilon = 0.19) that cannot be explained by a bare-rock surface model",
    "Evidence for spectral structure consistent with CO2 absorption at 15 micrometers, suggesting atmospheric composition includes greenhouse gases",
    "A likelihood ratio of 7.4 favoring atmosphere-bearing models over no-atmosphere scenarios"
  ],
  "why_caution_is_needed": [
    "The evidence for an atmosphere is moderate but not definitive; additional observations with broader wavelength coverage are needed to confirm findings",
    "Retrieval results depend on assumptions about atmospheric circulation, cloud properties, and composition, with significant degeneracies affecting interpretation",
    "Night-side thermal constraints are weaker than day-side measurements, limiting understanding of full heat redistribution patterns",
  "This study examined only one planet and cannot determine whether other similar planets around M dwarf stars would also retain atmospheres",
    "Stellar activity and instrument systematics could potentially affect the weak spectral feature detections reported"
  ],
  "glossary": [
    {
      "term": "Phase curve",
      "definition": "A measurement of how a planet's brightness changes as it orbits its star, revealing information about temperature differences between day and night sides and atmospheric properties."
    },
    {
      "term": "M dwarf",
      "definition": "A small, cool type of star (red dwarf) that is much dimmer and cooler than our Sun, but the most common type of star in our galaxy."
    },
    {
      "term": "Bond albedo",
      "definition": "The fraction of starlight reflected by a planet across all wavelengths; a low Bond albedo (<0.08) indicates the planet absorbs most incoming radiation."
    },
    {
      "term": "CO2 absorption band",
      "definition": "A specific wavelength range (around 15 micrometers) where carbon dioxide molecules absorb infrared light, creating a characteristic signature in planetary spectra."
    },
    {
      "term": "Heat redistribution efficiency",
      "definition": "A parameter describing how effectively heat is transported from a planet's day side to its night side; zero indicates no atmosphere, higher values indicate atmospheric circulation."
    },
    {
      "term": "Atmospheric retrieval",
      "definition": "A statistical analysis method that uses observed data to infer the properties (composition, temperature, pressure) of a planetary atmosphere by comparing data to theoretical models."
    }
  ],
  "open_questions": [
    "What is the exact composition of TRAPPIST-1 b's atmosphere—does it contain primarily CO2, or might other gases like nitrogen or water vapor be present?",
    "Could the observed heat redistribution be explained by alternative scenarios such as molten lava flows on the surface rather than an atmosphere?",
    "How does TRAPPIST-1 b's atmosphere survive under intense stellar radiation, and what does this imply for other Earth-sized planets around M dwarfs?",
    "Will observations at other wavelengths (near-infrared, visible) provide stronger constraints on atmospheric properties?",
    "Does TRAPPIST-1 b have clouds or hazes that affect the observed thermal emission and spectral signatures?",
    "How do the findings for TRAPPIST-1 b compare to atmospheric predictions from theoretical models of planet formation and evolution?"
  ]
}