{
  "headline": "JWST sees hints of a TRAPPIST-1 b atmosphere, but its composition is still uncertain",
  "plain_language_summary": "This study uses JWST MIRI phase-curve observations of the exoplanet TRAPPIST-1 b to ask whether the planet is truly airless or has an atmosphere. The researchers found that an airless model had trouble matching both how the planet brightens and cools through its orbit and its spectral shape near 15 microns at once. They also found non-zero day-night heat-transport and a 15-micron spectral feature consistent with CO2 absorption, along with a likelihood ratio that favors atmosphere-bearing models over no-atmosphere alternatives. Still, the work remains model-dependent: the team reports that O2-rich cases are not fully ruled out and that cloud, circulation, and compositional assumptions create strong degeneracies. In short, TRAPPIST-1 b appears to have evidence for an atmosphere, but more observations are still needed to pin down exactly what that atmosphere is.",
  "what_is_new": [
    "Combining orbital phase variations with spectral structure in one retrieval framework allowed the study to test airless versus atmosphere-bearing models jointly.",
    "Non-zero heat-transport efficiency and a preferred likelihood ratio for atmosphere-bearing models were reported from the combined fit.",
    "The paper introduces stronger-than-previous constraints from JWST thermal phase data on the 15 um CO2-sensitive region for TRAPPIST-1 b."
  ],
  "why_caution_is_needed": [
    "This is a single-planet study, so it cannot establish how common atmospheres are among all similar rocky M-dwarf worlds.",
    "Retrieval assumptions, including cloud treatment and circulation priors, can materially change retrieved quantitative values.",
    "Stellar variability and instrument systematics may bias weak spectral features, especially at the precision needed for this target.",
    "Night-side constraints are weaker than day-side constraints in the current dataset, reducing confidence in full day-night balance conclusions.",
    "O2-rich atmospheres are not excluded, so composition claims remain provisional until broader follow-up data arrive."
  ],
  "glossary": [
    {
      "term": "Phase curve",
      "definition": "Variation in observed planetary emission or flux as the planet orbits, used to infer how heat is distributed between day and night sides."
    },
    {
      "term": "Heat transport efficiency",
      "definition": "A parameter (often denoted epsilon) describing how much thermal energy moves from the dayside to the nightside in an atmosphere."
    },
    {
      "term": "Bond albedo",
      "definition": "The fraction of stellar radiation reflected away by a planet, which affects how hot the planet appears in thermal equilibrium estimates."
    },
    {
      "term": "Likelihood ratio",
      "definition": "A statistical comparison of how well two models explain the data, with values above 1 favoring the numerator model."
    }
  ],
  "open_questions": [
    "What additional wavelength coverage or higher signal-to-noise spectroscopy is required to break composition and cloud degeneracies for TRAPPIST-1 b?",
    "Can repeated observations confirm that the inferred transport efficiency and CO2 feature persist against stellar variability and instrumental systematics?",
    "How common are atmospheres on similarly irradiated rocky exoplanets around M-dwarf stars, and can this result be generalized beyond one target?"
  ]
}